city,company,task,time,pay,regDate
경기 안양시, 목구멍 안양점,직원 함께 할 분 모십니당,14:00~23:00,"월급2,500,000",2시간전
경기 안양시, 목구멍 안양점,직원 함께 할 분 모십니당,14:00~23:00,"월급2,500,000",2시간전
대구 달서구, 목구멍 대구달서점,목구멍 대구달서점과 함께 부자가 되고 싶으신분,15:30~23:30,"시급10,000",4시간전
경기 안양시, 목구멍 안양점,직원 함께 할 분 모십니당,14:00~23:00,"월급2,500,000",4시간전
부산 북구, 목구멍,목구멍 화명점과 함께 하실 알바생 구합니다 ( 홀서빙 ),18:00~23:00,"시급10,000",5시간전
경북 김천시, 목구멍 김천점,목구멍에서 아르바이트 하실 분 모집합니다,18:00~22:00,"시급11,000",5시간전
경북 김천시, 목구멍 김천점,목구멍에서 아르바이트 하실 분 모집합니다,18:00~22:00,"시급11,000",5시간전
부산 중구, 목구멍 남포점,목구멍남포점 정직원구합니다,18:00~01:00,"월급2,700,000",5시간전
경기 하남시, 목구멍 하남점,"목구멍 하남점에서 직원, 반직원 구합니다.",15:00~24:00,"월급2,900,000",6시간전
경기 하남시, 목구멍 하남점,목구멍 하남점에서 아르바이트 구합니다.,15:00~20:00,"시급11,000",6시간전
경기 시흥시, 목구멍 시흥점,목구멍 삼겹살 시흥점  파트타임 알바 모집(금토일) 남녀무관,17:30~22:00,"시급10,000",6시간전
부산 남구, 목구멍 대연점,대연점 목구멍 알바구합니당,,"시급9,800",6시간전
경북 김천시, 목구멍 김천점,목구멍에서 아르바이트 하실 분 모집합니다,,"시급11,000",23시간전
경북 김천시, 목구멍 김천점,목구멍에서 아르바이트 하실 분 모집합니다,,"시급11,000",07/17
경북 김천시, 목구멍 김천점,목구멍에서 함께 일하실 정직원 모집합니다,14:00~00:00,"월급2,600,000",07/17
부산 북구, 목구멍,목구멍 화명점과 함께 하실 알바생 구합니다 ( 홀서빙 ),18:00~23:00,"시급10,000",07/16
경기 하남시, 목구멍 하남점,목구멍 하남점에서 아르바이트 구합니다.,15:00~20:00,"시급11,000",07/16
부산 수영구, 목구멍 수영점,목구멍 수영점 주말 아르바이트구함,18:00~22:00,"시급11,000",07/15
부산 수영구, 목구멍 수영점,목구멍 수영점 아르바이트구함,18:00~22:00,"시급11,000",07/15
경기 남양주, 목구멍 남양주점,"목구멍 남양주 별내점 주방실장, 직원 구해요(+알바)",,"시급11,000",07/14
대구 동구, 목구멍 대구신세계점,목구멍  []대구 동구 신세계점[] 함께 하실분,17:00~00:30,"시급10,000",07/13
대구 동구, 목구멍 대구신세계점,목구멍  []대구 동구 신세계점[] 함께 하실분,17:00~00:30,"시급10,000",07/13
부산 해운대, 목구멍 반여점,목구멍 반여점에서 같이 일할 홀직원 및 파트타임 모집합니다.,14:00~24:00,"월급2,750,000",07/12
부산 서구, 목구멍 동대신점,목구멍 동대신점  알바구합니다,18:00~22:00,"시급9,500",07/12
경기 하남시, 목구멍 하남점,"목구멍 하남점에서 직원, 반직원 구합니다.",15:00~24:00,"월급2,900,000",07/12
대구 동구, 목구멍 대구신세계점,목구멍  []대구 동구 신세계점[] 함께 하실분,17:00~00:30,"시급10,000",07/11
부산 북구, 목구멍,목구멍 화명점과 함께 하실 알바생 구합니다 ( 홀서빙 ),18:00~23:00,"시급10,000",07/11
경기 군포시, 목구멍 군포점,목구멍 군포점  정규직  모집,,"월급2,400,000",07/11
대전 중구, 목구멍 대전대흥점,"대전 목구멍 대흥점,오류점 직원/아르바이트 모집",,"시급10,000",07/10
부산 중구, 목구멍,목구멍남포점 아르바이트 구합니다.(외국인가능),18:00~22:00,"시급10,000",07/10
부산 중구, 목구멍 남포점,목구멍남포점 정직원구합니다,18:00~01:00,"월급2,700,000",07/10
부산 중구, 목구멍,목구멍남포점 아르바이트 구합니다.(외국인가능),18:00~22:00,"시급10,000",07/10
대구 동구, 목구멍 대구신세계점,목구멍  []대구 동구 신세계점[] 함께 하실분,17:00~00:30,"시급10,000",07/08
경남 거제시, 목구멍 본점,목구멍 아주동 본점 홀서빙 알바&정직원 모집합니다.,,"월급2,500,000",07/05
대구 동구, 목구멍 대구신세계점,목구멍  []대구 동구 신세계점[] 함께 하실분,17:00~00:30,"시급10,000",07/05
부산 수영구, 목구멍 수영점,목구멍 수영점 직원 구함(월 6회 휴무),15:00~01:00,"월급2,600,000",07/05
경기 오산시, 목구멍 오산점,목구멍 오산점  홀알바 (월수목6-10)구합니다,18:00~22:00,"시급11,000",07/05
경기 오산시, 목구멍 오산점,목구멍 오산점  홀알바 (월수목6-10)구합니다,18:00~22:00,"시급11,000",07/05
부산 금정구, 목구멍 구서점,리뉴얼 목구멍 구서점 알바 구합니닿,17:00~22:00,"시급10,000",07/05
부산 금정구, 목구멍 구서점,구서  리뉴얼 목구멍 주방 실장님 구합니다ㅎ,15:00~24:00,"월급2,800,000",07/05
