city,company,task,time,pay,regDate
경기 안산시, 대교 눈높이 오름 러닝센터,대교 눈높이 오름러닝센터 교사모집,13:00~19:30,"월급2,500,000",1분전
경기 안산시, 대교 눈높이 본일 러닝센터,대교 눈높이 본일러닝센터 교사모집,13:00~19:30,"월급2,500,000",1분전
경기 안산시, 대교 눈높이 각골 러닝센터,대교 눈높이 각골러닝센터,13:00~19:30,"월급2,500,000",2분전
경기 안산시, 대교 눈높이 초당 러닝센터,대교 눈높이 초당러닝센터,13:00~19:30,"월급2,500,000",2분전
경기 안산시, 대교 눈높이 호동 러닝센터,대교 눈높이 호동러닝센터 교사모집,13:00~19:30,"월급2,500,000",4분전
경기 전체, 대교 눈높이 안산상록 교육국,(주)대교 눈높이 교사를 모집합니다.,13:00~19:30,"월급2,500,000",5분전
울산 북구, 대교 눈높이 월드 러닝센터,눈높이 러닝센터 월드학원에서 수리교사를 구합니다.,,"월급2,000,000",14분전
충북 청주시, 대교 눈높이 가경 러닝센터,"눈높이 가경러닝센터 수리,어문(국어,영어)선생님을 모집합니다.",13:00~20:00,"월급2,500,000",14분전
울산 북구, 대교 눈높이 상안 러닝센터,러닝센터 울산상안 학원에서 러닝센터 선생님을 모십니다.,,"월급2,000,000",15분전
경기 의정부, 대교 눈높이 송산 러닝센터,눈높이 송산러닝센터 수리 및 어문전문 선생님을 모십니다,,"월급2,100,000",26분전
서울 노원구, 대교 눈높이 노원 교육국,눈높이 선생님을 모집합니다,11:00~20:00,"월급2,500,000",33분전
부산 해운대, 대교 눈높이 더푸른 러닝센터,눈높이 더푸른러닝센터에서 함께 할 선생님을 모십니다.(고촌YC교사),,"월급3,000,000",46분전
서울 강동구, 대교 눈높이 천일 러닝센터,눈높이 천일러닝센터에서 선생님을 모십니다.,,"월급2,000,000",1시간전
서울 강동구, 대교 눈높이 강동성안 러닝센터,눈높이 강동성안러닝센터에서 선생님을 모십니다.,,"월급2,000,000",1시간전
울산 전체, 대교 눈높이 동부 러닝센터,(주)대교 눈높이 동부YC 공부방 운영 교사모집합니다.,13:00~20:30,"월급4,000,000",1시간전
서울 강동구, 대교 눈높이 강동 러닝센터,눈높이 강동러닝센터에서 선생님을 모십니다.,,"월급2,000,000",1시간전
서울 송파구, 대교 눈높이 강동풍납 러닝센터,눈높이 풍납러닝센터에서 영어 선생님을 모십니다.,,"월급2,000,000",1시간전
울산 전체, 대교 눈높이 염포 러닝센터,(주)대교 눈높이 염포러닝센터 교사모집합니다.,13:00~19:30,"월급2,000,000",1시간전
울산 전체, 대교 눈높이 전하 러닝센터,(주)대교 눈높이 전하러닝센터 교사모집합니다.,13:00~19:30,"월급2,300,000",1시간전
울산 동구, 대교 눈높이 울산동구 교육국,"(주)대교 눈높이울산동구교육국 방문,러닝센터교사모집합니다.(3년이상근무시",,"월급2,300,000",1시간전
서울 강동구, 대교 눈높이 강동둔촌 러닝센터,눈높이 둔촌러닝센터에서 선생님을 모십니다.,,"월급2,000,000",1시간전
대구 전체, 대교 눈높이 대구월성 교육국,눈높이 교사 및 러닝센터 강사 모집,,"월급2,000,000",1시간전
서울 강동구, 대교 눈높이 강동 교육국,눈높이 강동교육국에서 선생님을 모십니다.,,"월급2,000,000",1시간전
대구 북구, 대교 눈높이 칠성 러닝센터,"눈높이 방문, 러닝 교사모집",,"월급2,200,000",1시간전
대구 동구, 대교 눈높이 동대구 교육국,"눈높이 러닝, 방문교사 모집",,"월급2,000,000",1시간전
경북 구미시, 대교 눈높이 구미서부 교육국,눈높이 선생님을 모집합니다.,,"월급2,100,000",1시간전
경남 진주시, 대교 눈높이 하대 러닝센터,눈높이하대학원에서 수학강사를 모집합니다.,11:00~20:00,"월급2,200,000",2시간전
경남 진주시, 대교 눈높이 동진주 교육국,눈높이 선생님을 모집합니다. (사천읍관할내 방문교사1명),,"월급2,100,000",2시간전
대전 유성구, 대교 눈높이 신대전 교육국,눈높이교사모집(방문&러닝센터),,"월급2,000,000",2시간전
인천 전체, 대교 눈높이 부흥 러닝센터,동종업계 최고수수료율로 러닝센터 선생님을 모집합니다,,"월급2,200,000",2시간전
부산 전체, 대교 눈높이 부산사하 교육국,"눈높이 방문선생님을 모집합니다,",11:00~20:00,"월급2,500,000",2시간전
부산 전체, 대교 눈높이 부산사하 교육국,"눈높이 러닝센터 수학선생님을 모집합니다,",11:00~20:00,"월급2,500,000",2시간전
경기 의정부, 대교 눈높이 송산 러닝센터,눈높이 송산러닝센에서 수리 전문 선생님을 모십니다,,"월급2,000,000",2시간전
경기 양주시, 대교 눈높이 양주자이 러닝센터,눈높이 자이러닝센터에서 어문 및 수리전문 선생님을 모십니다,,"월급2,000,000",2시간전
경기 양주시, 대교 눈높이 양주고읍 러닝센터,"눈높이 양주고읍러닝센터에서 중등전문(수리,어문) 선생님을 모십니다",,"월급2,000,000",2시간전
경기 의정부, 대교 눈높이 민락 러닝센터,눈높이 민락러닝센터 수리 전문 선생님을 모십니다,,"월급2,000,000",2시간전
경북 안동시, 대교 눈높이 안동 교육국,"안동,의성,예천,청송 지역 눈높이 방문.러닝교사 강사 모집합니다.",,"월급2,200,000",2시간전
경기 고양시, 대교 눈높이 성저 러닝센터,러닝센터 유아교사 구합니다(주3회+3시간),,"월급1,000,000",2시간전
경기 화성시, 대교 눈높이 청계 러닝센터,(주) 대교 눈높이 에서  훌륭한 선생님이 될 수 있는 기회를 만나 보세요~,,"월급2,500,000",2시간전
경기 화성시, 대교 눈높이 정현 러닝센터,(주) 대교 눈높이에서  훌륭한 선생님이 될 수 있는 기회를 만나 보세요~,,"월급2,500,000",2시간전
